{"event_id":"11111111-1111-4111-8111-111111111117","event_type":"access.ready.v1","schema_version":1,"occurred_at":"2026-07-18T12:00:05Z","producer":"access-service","correlation_id":"22222222-2222-4222-8222-222222222222","causation_id":"11111111-1111-4111-8111-111111111113","aggregate_type":"access","aggregate_id":"44444444-4444-4444-8444-444444444444","aggregate_sequence":2,"partition_key":"user:88888888-8888-4888-8888-888888888888","data":{"subscription_id":"99999999-9999-4999-8999-999999999999","credential_id":"44444444-4444-4444-8444-444444444444","user_id":"88888888-8888-4888-8888-888888888888","provisioning_status":"active","ready_at":"2026-07-18T12:00:05Z","link_issuance_required":true}}
